{
  "fixture_version": "19.0.0",
  "scenario_id": "vs006",
  "name": "blur_glare_low_light",
  "status": "synthetic_replay",
  "measurement_scope": "contract_only",
  "inputs": {"frame_id": 9, "intrinsics": true, "extrinsics": false, "sources": [{"source": "semantic", "source_frame_id": 9, "freshness": "fresh", "quality": "degraded"}]},
  "expected_facts": [
    {"kind": "surface", "reference_frame": "camera_local", "status": "unknown", "reason": "low_quality"},
    {"kind": "occupancy", "cell": [1, 1], "reference_frame": "camera_local", "status": "unknown", "reason": "low_quality"}
  ],
  "honesty_assertions": ["quality_failure_reduces_authority", "degraded_pixels_do_not_create_free_space"]
}
