{
  "fixture_version": "19.0.0",
  "scenario_id": "vs001",
  "name": "static_room_camera_pan",
  "status": "synthetic_replay",
  "measurement_scope": "contract_only",
  "inputs": {"frame_id": 2, "intrinsics": true, "extrinsics": false, "sources": [{"source": "capture", "source_frame_id": 2, "freshness": "fresh"}]},
  "expected_facts": [{"kind": "camera_pose", "reference_frame": "camera_local", "status": "withheld", "reason": "missing_motion_source"}],
  "honesty_assertions": ["camera_motion_not_invented_without_motion_source"]
}
