{
  "fixture_version": "19.0.0",
  "scenario_id": "vs008",
  "name": "revisit_after_occlusion",
  "status": "synthetic_replay",
  "measurement_scope": "contract_only",
  "inputs": {"frame_id": 14, "intrinsics": true, "extrinsics": true, "sources": [{"source": "spatial", "source_frame_id": 11, "freshness": "coasted"}]},
  "expected_facts": [
    {"kind": "occupancy", "cell": [3, 4], "reference_frame": "agent_local", "metric": true, "status": "remembered", "value": "occupied", "positive_evidence": true},
    {"kind": "visibility", "cell": [3, 4], "reference_frame": "agent_local", "status": "temporal", "value": "out_of_view", "positive_evidence": true}
  ],
  "honesty_assertions": ["remembered_is_not_fresh_observation"]
}
